{
  "schema": "solarpunk.constraint.provenance_scenario.v1",
  "scenario_id": "PROVENANCE-L4-COUNTERFACTUAL",
  "name": "Externally corroborated revenue-grade assurance counterfactual",
  "kind": "ASSURANCE_COUNTERFACTUAL",
  "provenance_context": {
    "trusted_operator_context": true,
    "signed": true,
    "revenue_grade": true,
    "external_corroboration": true,
    "cryptographically_verified": true
  },
  "observed_evidence_changed": false,
  "boundary": "Declared assurance counterfactual only. The evidence hash is unchanged and no real revenue-grade meter, utility corroboration, operator identity, or new observed evidence is supplied."
}
